id,prd,clck,txt,tm,team,hmScr,awyScr,sq,plyTypId,scrng,wnPrb
401809237454,3,3:05,Will Richard defensive rebound,9,DEN,84,85,454,155,,53.9
401809237455,3,2:58,Al Horford makes 23-foot three point jumper (Buddy Hield assists),9,GS,87,85,455,92,True,55
401809237457,3,2:44,Peyton Watson bad pass (Jimmy Butler III steals),7,GS,87,85,457,62,,59.5
401809237459,3,2:35,Tim Hardaway Jr. shooting foul,7,GS,87,85,459,44,,66.2
401809237461,3,2:35,Jimmy Butler III makes free throw 1 of 2,9,GS,88,85,461,98,True,67.2
401809237462,3,2:35,Jimmy Butler III makes free throw 2 of 2,9,GS,89,85,462,99,True,63.8
401809237463,3,2:24,Nikola Jokic misses 25-foot three point jumper,7,GS,89,85,463,92,,67.3
401809237464,3,2:21,Will Richard defensive rebound,9,GS,89,85,464,155,,68.5
401809237465,3,2:13,Bruce Brown blocks Jimmy Butler III 's 18-foot pullup jump shot,9,GS,89,85,465,131,,65.2
401809237467,3,2:11,Nikola Jokic defensive rebound,7,GS,89,85,467,155,,64.1
401809237468,3,2:00,Tim Hardaway Jr. makes 19-foot jumper (Nikola Jokic assists),7,GS,89,87,468,92,True,59.8
401809237470,3,1:36,Al Horford lost ball turnover (Tim Hardaway Jr. steals),9,GS,89,87,470,63,,55.6
401809237472,3,1:33,Jimmy Butler III shooting foul,9,DEN,89,87,472,44,,51.5
401809237474,3,1:33,Jamal Murray makes free throw 1 of 2,7,DEN,89,88,474,98,True,52.6
401809237475,3,1:33,Jonas Valanciunas enters the game for Nikola Jokic,7,DEN,89,88,475,584,,52.6
401809237477,3,1:33,Jamal Murray makes free throw 2 of 2,7,GS,89,89,477,99,True,50.6
401809237497,3,1:21,Will Richard makes 8-foot layup (Al Horford assists),9,GS,91,89,497,141,True,55.6
401809237480,3,1:03,Jamal Murray makes 10-foot two point shot (Bruce Brown assists),7,DEN,89,91,480,130,True,58.6
401809237481,3,59.5,Bruce Brown personal foul,7,GS,89,91,481,45,,58.3
401809237483,3,59.5,Jimmy Butler III misses free throw 1 of 2,9,GS,89,91,483,98,,54.8
401809237484,3,59.5,Warriors offensive team rebound,9,GS,89,91,484,156,,50.7
401809237485,3,59.5,Jimmy Butler III makes free throw 2 of 2,9,GS,90,91,485,99,True,50.9
401809237486,3,49.8,Jamal Murray misses 26-foot three point pullup jump shot,7,GS,90,91,486,131,,54.8
401809237487,3,47.2,Buddy Hield defensive rebound,9,GS,90,91,487,155,,56.2
401809237489,3,30.8,Buddy Hield makes 15-foot step back jumpshot (Jimmy Butler III assists),9,GS,92,91,489,132,True,51
401809237491,3,12.3,Tim Hardaway Jr. misses 25-foot three point step back jumpshot,7,GS,92,91,491,132,,64.2
401809237492,3,9.8,Peyton Watson offensive rebound,7,GS,92,91,492,156,,60.6
401809237493,3,1.3,Jamal Murray makes 24-foot three point step back jumpshot,7,DEN,92,94,493,132,True,58.7
401809237494,3,0.6,Brandin Podziemski misses heave jump shot,9,DEN,92,94,494,282,,62.7
401809237495,3,0.1,Warriors offensive team rebound,9,DEN,92,94,495,156,,58.8
401809237496,3,0.0,End of the 3rd Quarter,,DEN,92,94,496,412,,61.4
401809237500,4,12:00,Draymond Green enters the game for Al Horford,9,DEN,94,94,500,584,,61.4
401809237503,4,11:47,Jamal Murray shooting foul,7,GS,94,94,503,44,,60.2
401809237505,4,11:47,Jimmy Butler III makes free throw 1 of 2,9,GS,95,94,505,98,True,60.6
401809237506,4,11:47,Jimmy Butler III makes free throw 2 of 2,9,GS,96,94,506,99,True,56.9
401809237507,4,11:36,Tim Hardaway Jr. makes 27-foot three point jumper (Jamal Murray assists),7,DEN,96,97,507,92,True,52.8
401809237509,4,11:06,Draymond Green makes 25-foot three point jumper (Jimmy Butler III assists),9,GS,99,97,509,92,True,57.2
401809237511,4,10:43,Bruce Brown makes 11-foot two point shot,7,GS,99,99,511,136,True,52.2
401809237512,4,10:26,Bruce Brown shooting foul,7,GS,99,99,512,44,,61.8
401809237514,4,10:26,Will Richard makes free throw 1 of 2,9,GS,100,99,514,98,True,62.2
401809237515,4,10:26,Will Richard misses free throw 2 of 2,9,GS,100,99,515,99,,52.8
401809237516,4,10:24,Jonas Valanciunas defensive rebound,7,GS,100,99,516,155,,52.8
401809237517,4,10:04,Jamal Murray bad pass (Will Richard steals),7,GS,100,99,517,62,,58.4
401809237519,4,9:50,Jimmy Butler III misses 14-foot two point shot,9,GS,100,99,519,114,,54.3
401809237520,4,9:48,Bruce Brown defensive rebound,7,GS,100,99,520,155,,52.9
401809237521,4,9:43,Jamal Murray lost ball turnover (Brandin Podziemski steals),7,GS,100,99,521,63,,58.6
401809237523,4,9:39,Buddy Hield misses 26-foot three point shot,9,GS,100,99,523,113,,54.3
401809237524,4,9:37,Jonas Valanciunas defensive rebound,7,GS,100,99,524,155,,52.9
401809237525,4,9:37,Brandin Podziemski personal foul,9,GS,100,99,525,45,,51.4
401809237527,4,9:37,Aaron Gordon enters the game for Peyton Watson,7,GS,100,99,527,584,,51.4
401809237529,4,9:23,Aaron Gordon makes 2-foot alley oop dunk shot (Jamal Murray assists),7,DEN,100,101,529,118,True,52.9
401809237531,4,9:10,Will Richard misses 26-foot three point jumper,9,DEN,100,101,531,92,,57.2
401809237532,4,9:09,Aaron Gordon defensive rebound,7,DEN,100,101,532,155,,58.6
401809237533,4,8:52,Jonas Valanciunas misses 15-foot jumper,7,DEN,100,101,533,92,,54.3
401809237534,4,8:50,Brandin Podziemski defensive rebound,9,DEN,100,101,534,155,,52.9
401809237535,4,8:45,Brandin Podziemski misses 25-foot three point pullup jump shot,9,DEN,100,101,535,131,,57.3
401809237536,4,8:44,Nuggets defensive team rebound,7,DEN,100,101,536,155,,58.7
401809237538,4,8:35,Aaron Gordon makes 22-foot three point jumper (Jonas Valanciunas assists),7,DEN,100,104,538,92,True,69.5
401809237540,4,8:21,Jonas Valanciunas blocks Jimmy Butler III 's 4-foot jumper,9,DEN,100,104,540,92,,73.4
401809237542,4,8:20,Bruce Brown defensive rebound,7,DEN,100,104,542,155,,74.7
401809237543,4,8:19,Bruce Brown misses two point shot,7,DEN,100,104,543,109,,70.9
401809237544,4,8:17,Draymond Green defensive rebound,9,DEN,100,104,544,155,,69.7
401809237545,4,8:10,Will Richard misses 23-foot three point shot,9,DEN,100,104,545,113,,73.5
401809237546,4,8:05,Tim Hardaway Jr. defensive rebound,7,DEN,100,104,546,155,,74.9
401809237547,4,7:53,Aaron Gordon makes 12-foot pullup jump shot,7,DEN,100,106,547,131,True,79.5
401809237548,4,7:53,Warriors Full timeout,9,DEN,100,106,548,16,,79.5
401809237550,4,7:53,Stephen Curry enters the game for Buddy Hield,9,DEN,100,106,550,584,,79.5
401809237551,4,7:53,Al Horford enters the game for Jimmy Butler III,9,DEN,100,106,551,584,,79.5
401809237552,4,7:53,Jonathan Kuminga enters the game for Draymond Green,9,DEN,100,106,552,584,,79.5
401809237553,4,7:53,Nikola Jokic enters the game for Jonas Valanciunas,7,DEN,100,106,553,584,,79.5
401809237554,4,7:53,Christian Braun enters the game for Jamal Murray,7,DEN,100,106,554,584,,79.5
401809237560,4,7:30,Brandin Podziemski misses driving floating jump shot,9,DEN,100,106,560,144,,83.1
401809237561,4,7:25,Bruce Brown defensive rebound,7,DEN,100,106,561,155,,84.3
401809237562,4,7:22,Aaron Gordon makes driving layup (Bruce Brown assists),7,DEN,100,108,562,110,True,87.4
401809237563,4,7:22,Will Richard shooting foul,9,DEN,100,108,563,44,,92.9
401809237565,4,7:22,Aaron Gordon makes free throw 1 of 1,7,DEN,100,109,565,97,True,90.7
401809237566,4,7:04,Jonathan Kuminga misses 26-foot three point jumper,9,DEN,100,109,566,92,,92.9
401809237567,4,7:01,Christian Braun defensive rebound,7,DEN,100,109,567,155,,93.5
401809237568,4,6:52,Nikola Jokic misses 12-foot two point shot,7,DEN,100,109,568,130,,91.9
401809237569,4,6:52,Warriors defensive team rebound,9,DEN,100,109,569,155,,91.4
401809237570,4,6:52,Bruce Brown vs. Stephen Curry (Will Richard gains possession),9,DEN,100,109,570,615,,91.4
401809237575,4,6:44,Will Richard makes 24-foot three pointer,9,DEN,103,109,575,131,True,85.8
401809237576,4,6:23,Nikola Jokic misses 25-foot three point jumper,7,DEN,103,109,576,92,,83.2
401809237577,4,6:20,Will Richard defensive rebound,9,DEN,103,109,577,155,,82.2
401809237578,4,6:05,Stephen Curry makes driving layup,9,DEN,105,109,578,110,True,78.3
401809237579,4,6:05,Nuggets Full timeout,7,DEN,105,109,579,16,,78.3
401809237581,4,6:05,Cameron Johnson enters the game for Tim Hardaway Jr.,7,DEN,105,109,581,584,,78.3
401809237582,4,6:05,Jamal Murray enters the game for Bruce Brown,7,DEN,105,109,582,584,,78.3
401809237585,4,5:51,Jamal Murray makes layup (Nikola Jokic assists),7,DEN,105,111,585,95,True,82.9
401809237588,4,5:30,Nikola Jokic personal foul,7,DEN,105,111,588,45,,81.7
401809237590,4,5:23,Jonathan Kuminga makes 1-foot dunk (Will Richard assists),9,DEN,107,111,590,117,True,78.4
401809237593,4,5:23,Jamal Murray shooting foul,7,DEN,107,111,593,44,,66.8
401809237595,4,5:23,Jonathan Kuminga misses free throw 1 of 1,9,DEN,107,111,595,97,,77.1
401809237596,4,5:20,Cameron Johnson defensive rebound,7,DEN,107,111,596,155,,77.2
401809237597,4,5:12,Cameron Johnson makes 23-foot three point jumper (Aaron Gordon assists),7,DEN,107,114,597,92,True,86.5
401809237599,4,4:57,Stephen Curry makes two point shot,9,DEN,109,114,599,126,True,82.7
401809237600,4,4:39,Aaron Gordon misses 10-foot two point shot,7,DEN,109,114,600,136,,79.4
401809237601,4,4:37,Will Richard defensive rebound,9,DEN,109,114,601,155,,78.3
401809237602,4,4:26,Al Horford bad pass (Cameron Johnson steals),9,DEN,109,114,602,62,,83.4
401809237604,4,4:21,Christian Braun out of bounds lost ball turnover,7,DEN,109,114,604,87,,78.6
401809237605,4,4:21,Jimmy Butler III enters the game for Will Richard,9,DEN,109,114,605,584,,78.6
401809237607,4,4:02,Stephen Curry misses 26-foot three point jumper,9,DEN,109,114,607,92,,82.8
401809237608,4,4:00,Aaron Gordon defensive rebound,7,DEN,109,114,608,155,,84.1
401809237609,4,3:50,Nikola Jokic makes 10-foot two point shot,7,DEN,109,116,609,114,True,88.7
401809237610,4,3:50,Warriors Full timeout,9,DEN,109,116,610,16,,88.7
401809237611,4,3:50,Draymond Green enters the game for Brandin Podziemski,9,DEN,109,116,611,584,,88.7
401809237613,4,3:30,Draymond Green misses 24-foot three point jumper,9,DEN,109,116,613,92,,91.9
401809237614,4,3:26,Jimmy Butler III offensive rebound,9,DEN,109,116,614,156,,89.5
401809237615,4,3:26,Jimmy Butler III misses 32-foot three point jumper,9,DEN,109,116,615,92,,92.1
401809237616,4,3:25,Warriors offensive team rebound,9,DEN,109,116,616,156,,89.5
401809237617,4,3:25,shot clock turnover ,9,DEN,109,116,617,70,,92.9
401809237618,4,3:03,Jamal Murray misses 20-foot step back jumpshot,7,DEN,109,116,618,132,,91.2
401809237619,4,3:02,Nikola Jokic offensive rebound,7,DEN,109,116,619,156,,93.7
401809237620,4,2:50,Nikola Jokic misses 4-foot two point shot,7,DEN,109,116,620,119,,91.6
401809237621,4,2:48,Draymond Green defensive rebound,9,DEN,109,116,621,155,,90.9
401809237622,4,2:42,Cameron Johnson shooting foul,7,DEN,109,116,622,44,,84.6
401809237624,4,2:42,Stephen Curry makes free throw 1 of 2,9,DEN,110,116,624,98,True,83.4
401809237625,4,2:42,Stephen Curry makes free throw 2 of 2,9,DEN,111,116,625,99,True,87.6
401809237626,4,2:23,Jamal Murray misses driving layup,7,DEN,111,116,626,110,,84.5
401809237627,4,2:20,Warriors defensive team rebound,9,DEN,111,116,627,155,,83.4
401809237629,4,2:06,Christian Braun shooting foul,7,DEN,111,116,629,44,,73.6
401809237631,4,2:06,Stephen Curry makes free throw 1 of 3,9,DEN,112,116,631,100,True,71.9
401809237632,4,2:06,Stephen Curry makes free throw 2 of 3,9,DEN,113,116,632,101,True,63.2
401809237633,4,2:06,Stephen Curry makes free throw 3 of 3,9,DEN,114,116,633,102,True,70.3
401809237634,4,1:46,Stephen Curry personal foul,9,DEN,114,116,634,45,,83.4
401809237637,4,1:36,Al Horford shooting foul,9,DEN,114,116,637,44,,79.3
401809237639,4,1:36,Nikola Jokic makes free throw 1 of 2,7,DEN,114,117,639,98,True,85.4
401809237640,4,1:36,Nikola Jokic misses free throw 2 of 2,7,DEN,114,117,640,99,,73.1
401809237641,4,1:34,Draymond Green defensive rebound,9,DEN,114,117,641,155,,73.1
401809237642,4,1:24,Stephen Curry makes 26-foot three pointer,9,DEN,117,117,642,131,True,54.6
401809237643,4,1:00,Jamal Murray misses 11-foot pullup jump shot,7,GS,117,117,643,131,,51.9
401809237644,4,56.1,Draymond Green defensive rebound,9,GS,117,117,644,155,,54.1
401809237645,4,43.7,Stephen Curry misses two point shot,9,DEN,117,117,645,126,,52.3
401809237646,4,42.0,Nikola Jokic defensive rebound,7,DEN,117,117,646,155,,54.4
401809237647,4,26.0,Aaron Gordon makes 26-foot three point jumper (Nikola Jokic assists),7,DEN,117,120,647,92,True,78.4
401809237649,4,25.7,Warriors Full timeout,9,DEN,117,120,649,16,,78.5
401809237650,4,25.7,Brandin Podziemski enters the game for Jonathan Kuminga,9,DEN,117,120,650,584,,78.5
401809237651,4,25.7,Buddy Hield enters the game for Al Horford,9,DEN,117,120,651,584,,78.5
401809237654,4,21.9,Stephen Curry makes 34-foot three pointer (Draymond Green assists),9,DEN,120,120,654,131,True,54.6
401809237656,4,21.4,Nuggets Full timeout,7,DEN,120,120,656,16,,54.6
401809237657,4,21.4,Al Horford enters the game for Jimmy Butler III,9,DEN,120,120,657,584,,54.6
401809237658,4,21.4,Jonathan Kuminga enters the game for Brandin Podziemski,9,DEN,120,120,658,584,,54.6
401809237659,4,21.4,Gary Payton II enters the game for Buddy Hield,9,DEN,120,120,659,584,,54.6
401809237663,4,2.7,Nikola Jokic misses finger roll layup,7,GS,120,120,663,124,,50.6
401809237664,4,0.9,Nuggets offensive team rebound,7,DEN,120,120,664,156,,50.5
401809237665,4,0.0,End of the 4th Quarter,,,120,120,665,412,,50
401809237666,5,5:00,Jimmy Butler III enters the game for Gary Payton II,9,,120,120,666,584,,50
401809237670,5,5:00,Nikola Jokic vs. Al Horford (Stephen Curry gains possession),9,,120,120,670,615,,50
401809237673,5,4:42,Jonathan Kuminga misses 6-foot two point shot,9,DEN,120,120,673,114,,51.7
401809237674,5,4:41,Jonathan Kuminga offensive rebound,9,GS,120,120,674,156,,53.3
401809237675,5,4:41,Jonathan Kuminga misses two point shot,9,DEN,120,120,675,125,,51.7
401809237676,5,4:40,Aaron Gordon defensive rebound,7,DEN,120,120,676,155,,53.4
401809237677,5,4:22,Cameron Johnson misses 25-foot three point jumper,7,GS,120,120,677,92,,51.7
401809237678,5,4:20,Stephen Curry defensive rebound,9,GS,120,120,678,155,,53.4
401809237679,5,4:12,Nikola Jokic personal foul,7,GS,120,120,679,45,,54.4
401809237681,5,4:04,Stephen Curry makes 28-foot three point jumper (Jimmy Butler III assists),9,GS,123,120,681,92,True,68.6
401809237683,5,3:45,Aaron Gordon makes driving layup,7,GS,123,122,683,110,True,61.9
401809237685,5,3:45,Al Horford shooting foul,9,GS,123,122,685,44,,63.1
401809237687,5,3:45,Aaron Gordon makes free throw 1 of 1,7,GS,123,123,687,97,True,54
401809237688,5,3:28,Stephen Curry misses driving floating jump shot,9,DEN,123,123,688,144,,52.1
401809237689,5,3:27,Christian Braun defensive rebound,7,DEN,123,123,689,155,,54.2
401809237690,5,3:13,Nikola Jokic makes 10-foot pullup jump shot (Jamal Murray assists),7,DEN,123,125,690,131,True,62.2
401809237692,5,2:58,Al Horford makes 23-foot three point jumper (Jimmy Butler III assists),9,GS,126,125,692,92,True,54.4
401809237694,5,2:43,Jamal Murray bad pass (Stephen Curry steals),7,GS,126,125,694,62,,63.1
401809237696,5,2:39,Jonathan Kuminga makes two point shot,9,GS,128,125,696,109,True,71.4
401809237698,5,2:39,Nuggets Full timeout,7,GS,128,125,698,16,,71.4
401809237699,5,2:26,Jamal Murray makes driving layup,7,GS,128,127,699,110,True,63.4
401809237700,5,2:00,Draymond Green makes layup (Jimmy Butler III assists),9,GS,130,127,700,95,True,73.5
401809237702,5,2:00,Aaron Gordon defensive goaltending violation,7,GS,130,127,702,9,,73.5
401809237703,5,1:43,Nikola Jokic misses 25-foot three point jumper,7,GS,130,127,703,92,,80.7
401809237704,5,1:40,Draymond Green defensive rebound,9,GS,130,127,704,155,,82.9
401809237705,5,1:21,Stephen Curry lost ball turnover (Nikola Jokic steals),9,GS,130,127,705,63,,76.2
401809237707,5,1:05,Nikola Jokic misses layup,7,GS,130,127,707,95,,83.7
401809237709,5,1:02,Jimmy Butler III defensive rebound,9,GS,130,127,709,155,,86
401809237710,5,40.7,Jimmy Butler III makes 24-foot three point jumper (Al Horford assists),9,GS,133,127,710,92,True,95
401809237712,5,32.2,Nikola Jokic misses 25-foot three point jumper,7,GS,133,127,712,92,,97.1
401809237713,5,30.5,Stephen Curry defensive rebound,9,GS,133,127,713,155,,97.7
401809237714,5,23.9,Stephen Curry makes two point shot,9,GS,135,127,714,109,True,99.1
401809237715,5,23.9,Nuggets Full timeout,7,GS,135,127,715,16,,99.1
401809237716,5,20.0,Aaron Gordon makes 2-foot driving dunk (Christian Braun assists),7,GS,135,129,716,115,True,98.3
401809237717,5,19.6,Christian Braun personal take foul,7,GS,135,129,717,22,,99.7
401809237719,5,18.5,Christian Braun personal take foul,7,GS,135,129,719,22,,99.7
401809237721,5,18.5,Stephen Curry makes free throw 1 of 2,9,GS,136,129,721,98,True,99.8
401809237722,5,18.5,Stephen Curry makes free throw 2 of 2,9,GS,137,129,722,99,True,99.3
401809237723,5,6.6,Nikola Jokic misses 24-foot three point jumper,7,GS,137,129,723,92,,99.8
401809237724,5,5.1,Christian Braun offensive rebound,7,GS,137,129,724,156,,99.8
401809237725,5,5.1,Christian Braun makes tip shot,7,GS,137,131,725,94,True,99.6
401809237727,5,0.0,End of the 1st  Overtime,,GS,137,131,727,412,,100
401809237728,5,0.0,End of Game,,GS,137,131,728,402,,100
