id,prd,clck,txt,tm,team,hmScr,awyScr,sq,plyTypId,scrng,wnPrb
4018099704,1,12:00,Kristaps Porzingis vs. Nikola Vucevic (Jalen Johnson gains possession),1,ATL,0,0,4,615,,58.9
4018099707,1,11:45,Kristaps Porzingis misses 16-foot jumper,1,ATL,0,0,7,92,,57.4
4018099708,1,11:43,Matas Buzelis defensive rebound,4,ATL,0,0,8,155,,56.9
4018099709,1,11:33,Isaac Okoro misses driving layup,4,ATL,0,0,9,110,,58.4
40180997010,1,11:31,Dyson Daniels defensive rebound,1,ATL,0,0,10,155,,58.9
40180997011,1,11:21,Kristaps Porzingis makes dunk (Dyson Daniels assists),1,ATL,0,2,11,151,True,61.6
40180997013,1,11:14,Isaac Okoro lost ball turnover (Dyson Daniels steals),4,ATL,0,2,13,63,,63.8
40180997015,1,11:09,Dyson Daniels bad pass (Tre Jones steals),1,ATL,0,2,15,62,,61.6
40180997017,1,11:05,Matas Buzelis makes two point shot (Tre Jones assists),4,ATL,2,2,17,129,True,58.8
40180997019,1,10:48,Trae Young misses 25-foot three point step back jumpshot,1,ATL,2,2,19,132,,57.3
40180997020,1,10:44,Matas Buzelis defensive rebound,4,ATL,2,2,20,155,,56.8
40180997021,1,10:32,Matas Buzelis misses 24-foot three point jumper,4,ATL,2,2,21,92,,58.2
40180997022,1,10:29,Dyson Daniels defensive rebound,1,ATL,2,2,22,155,,58.7
40180997023,1,10:23,Trae Young misses two point shot,1,ATL,2,2,23,127,,57.2
40180997024,1,10:18,Josh Giddey defensive rebound,4,ATL,2,2,24,155,,56.7
40180997025,1,10:16,Isaac Okoro makes two point shot (Josh Giddey assists),4,ATL,4,2,25,127,True,53.8
40180997027,1,10:06,Kristaps Porzingis makes 29-foot three point jumper (Dyson Daniels assists),1,ATL,4,5,27,92,True,58.8
40180997029,1,9:46,Josh Giddey bad pass (Dyson Daniels steals),4,ATL,4,5,29,62,,61.8
40180997031,1,9:39,Jalen Johnson makes 7-foot driving floating jump shot,1,ATL,4,7,31,144,True,63.6
40180997032,1,9:16,Tre Jones misses driving floating jump shot,4,ATL,4,7,32,144,,65.5
40180997033,1,9:15,Dyson Daniels defensive rebound,1,ATL,4,7,33,155,,66.2
40180997034,1,9:10,Trae Young misses driving floating jump shot,1,ATL,4,7,34,144,,64.2
40180997035,1,9:08,Josh Giddey defensive rebound,4,ATL,4,7,35,155,,63.6
40180997036,1,9:02,Josh Giddey makes two point shot,4,ATL,6,7,36,109,True,61.7
40180997037,1,8:52,Kristaps Porzingis makes 25-foot three point jumper (Trae Young assists),1,ATL,6,10,37,92,True,65.9
40180997039,1,8:35,Josh Giddey bad pass (Jalen Johnson steals),4,ATL,6,10,39,62,,68.4
40180997041,1,8:32,Matas Buzelis shooting foul,4,ATL,6,10,41,44,,71.7
40180997043,1,8:32,Jalen Johnson makes free throw 1 of 2,1,ATL,6,11,43,98,True,72.3
40180997044,1,8:32,Jalen Johnson makes free throw 2 of 2,1,ATL,6,12,44,99,True,70.6
40180997045,1,8:18,Josh Giddey makes layup (Nikola Vucevic assists),4,ATL,8,12,45,142,True,68.3
40180997047,1,8:02,Kristaps Porzingis makes 14-foot two point shot,1,ATL,8,14,47,114,True,70.5
40180997048,1,7:51,Nikola Vucevic out of bounds bad pass turnover,4,ATL,8,14,48,90,,72.9
40180997049,1,7:51,Kevin Huerter enters the game for Tre Jones,4,ATL,8,14,49,584,,72.9
40180997051,1,7:38,Trae Young makes driving layup,1,ATL,8,16,51,110,True,74.9
40180997052,1,7:30,Isaac Okoro misses 25-foot three point jumper,4,ATL,8,16,52,92,,76.4
40180997053,1,7:27,Kristaps Porzingis defensive rebound,1,ATL,8,16,53,155,,76.9
40180997054,1,7:19,Jalen Johnson misses 13-foot two point shot,1,ATL,8,16,54,137,,75.4
40180997055,1,7:15,Josh Giddey defensive rebound,4,ATL,8,16,55,155,,74.9
40180997056,1,7:03,Kevin Huerter makes driving layup,4,ATL,10,16,56,110,True,72.9
40180997057,1,6:53,Josh Giddey blocks Dyson Daniels's driving layup,1,ATL,10,16,57,110,,71.1
40180997058,1,6:51,Nikola Vucevic defensive rebound,4,ATL,10,16,58,155,,70.5
40180997059,1,6:48,Kevin Huerter makes two point shot (Matas Buzelis assists),4,ATL,12,16,59,129,True,68.3
40180997061,1,6:32,Kristaps Porzingis misses 27-foot three point jumper,1,ATL,12,16,61,92,,66.4
40180997062,1,6:30,Matas Buzelis defensive rebound,4,ATL,12,16,62,155,,65.8
40180997063,1,6:21,Josh Giddey misses 21-foot pullup jump shot,4,ATL,12,16,63,131,,67.6
40180997064,1,6:16,Trae Young defensive rebound,1,ATL,12,16,64,155,,68.2
40180997065,1,6:15,Zaccharie Risacher makes dunk (Trae Young assists),1,ATL,12,18,65,116,True,70.5
40180997067,1,6:15,Bulls Full timeout,4,ATL,12,18,67,16,,70.5
40180997069,1,6:15,Patrick Williams enters the game for Isaac Okoro,4,ATL,12,18,69,584,,70.5
40180997070,1,6:15,Luke Kennard enters the game for Kristaps Porzingis,1,ATL,12,18,70,584,,70.5
40180997071,1,6:15,Onyeka Okongwu enters the game for Zaccharie Risacher,1,ATL,12,18,71,584,,70.5
40180997072,1,6:15,Nickeil Alexander-Walker enters the game for Trae Young,1,ATL,12,18,72,584,,70.5
40180997077,1,5:59,Nikola Vucevic makes 6-foot two point shot (Patrick Williams assists),4,ATL,14,18,77,120,True,68.2
40180997079,1,5:46,Jalen Johnson makes driving layup (Luke Kennard assists),1,ATL,14,20,79,110,True,70.6
40180997081,1,5:46,Matas Buzelis shooting foul,4,ATL,14,20,81,44,,74.4
40180997083,1,5:46,Jalen Johnson makes free throw 1 of 1,1,ATL,14,21,83,97,True,72.9
40180997084,1,5:27,Matas Buzelis misses 23-foot three point jumper,4,ATL,14,21,84,92,,74.4
40180997085,1,5:24,Onyeka Okongwu defensive rebound,1,ATL,14,21,85,155,,74.9
40180997086,1,5:17,Jalen Johnson bad pass (Nikola Vucevic steals),1,ATL,14,21,86,62,,72.9
40180997088,1,4:58,Josh Giddey makes 3-foot two point shot,4,ATL,16,21,88,119,True,70.7
40180997089,1,4:47,Nickeil Alexander-Walker misses 24-foot three point jumper,1,ATL,16,21,89,92,,68.9
40180997090,1,4:45,Josh Giddey defensive rebound,4,ATL,16,21,90,155,,68.3
40180997091,1,4:41,Jalen Johnson shooting foul,1,ATL,16,21,91,44,,64.6
40180997095,1,4:41,Matas Buzelis misses free throw 1 of 2,4,ATL,16,21,95,98,,66.3
40180997096,1,4:41,Bulls offensive team rebound,4,ATL,16,21,96,156,,68.3
40180997097,1,4:41,Mouhamed Gueye enters the game for Jalen Johnson,1,ATL,16,21,97,584,,68.3
40180997099,1,4:41,Matas Buzelis makes free throw 2 of 2,4,ATL,17,21,99,99,True,68.3
401809970100,1,4:30,Mouhamed Gueye misses 23-foot three point jumper,1,ATL,17,21,100,92,,66.4
401809970101,1,4:28,Onyeka Okongwu offensive rebound,1,ATL,17,21,101,156,,68.3
401809970102,1,4:24,Nickeil Alexander-Walker makes 24-foot three point jumper (Luke Kennard assists),1,ATL,17,24,102,92,True,72.9
401809970104,1,4:10,Nikola Vucevic misses 26-foot three point jumper,4,ATL,17,24,104,92,,74.6
401809970105,1,4:07,Matas Buzelis offensive rebound,4,ATL,17,24,105,156,,72.9
401809970106,1,4:05,Patrick Williams misses 25-foot three point jumper,4,ATL,17,24,106,92,,74.6
401809970107,1,4:02,Luke Kennard defensive rebound,1,ATL,17,24,107,155,,75.2
401809970111,1,3:57,Kevin Huerter shooting foul,4,ATL,17,24,111,44,,76.7
401809970113,1,3:57,Luke Kennard makes free throw 1 of 2,1,ATL,17,25,113,98,True,78.6
401809970114,1,3:57,Tre Jones enters the game for Josh Giddey,4,ATL,17,25,114,584,,78.6
401809970115,1,3:57,Ayo Dosunmu enters the game for Nikola Vucevic,4,ATL,17,25,115,584,,78.6
401809970116,1,3:57,Jalen Smith enters the game for Matas Buzelis,4,ATL,17,25,116,584,,78.6
401809970117,1,3:57,Trae Young enters the game for Dyson Daniels,1,ATL,17,25,117,584,,78.6
401809970122,1,3:57,Luke Kennard makes free throw 2 of 2,1,ATL,17,26,122,99,True,77.1
401809970123,1,3:32,Patrick Williams misses 28-foot three point jumper,4,ATL,17,26,123,92,,78.7
401809970124,1,3:28,Onyeka Okongwu defensive rebound,1,ATL,17,26,124,155,,79.2
401809970126,1,3:10,Trae Young misses two point shot,1,ATL,17,26,126,145,,77.7
401809970127,1,3:08,Tre Jones defensive rebound,4,ATL,17,26,127,155,,77.2
401809970128,1,3:04,Onyeka Okongwu kicked ball violation,1,ATL,17,26,128,12,,79.3
401809970129,1,2:57,Onyeka Okongwu blocks Jalen Smith 's 27-foot three point jumper,4,ATL,17,26,129,92,,78.8
401809970131,1,2:53,Jalen Smith offensive rebound,4,ATL,17,26,131,156,,77.2
401809970132,1,2:52,Jalen Smith offensive foul,4,ATL,17,26,132,42,,79.4
401809970134,1,2:52,Jalen Smith turnover,4,ATL,17,26,134,84,,79.4
401809970135,1,2:52,Hawks Full timeout,1,ATL,17,26,135,16,,79.4
401809970136,1,2:39,Mouhamed Gueye makes 1-foot dunk (Trae Young assists),1,ATL,17,28,136,151,True,81.2
401809970139,1,2:16,Jalen Smith misses 22-foot jumper,4,ATL,17,28,139,92,,82.7
401809970140,1,2:14,Nickeil Alexander-Walker defensive rebound,1,ATL,17,28,140,155,,83.2
401809970141,1,2:10,Ayo Dosunmu shooting foul,4,ATL,17,28,141,44,,85.5
401809970143,1,2:10,Nickeil Alexander-Walker makes free throw 1 of 2,1,ATL,17,29,143,98,True,85.9
401809970144,1,2:10,Nickeil Alexander-Walker misses free throw 2 of 2,1,ATL,17,29,144,99,,82.9
401809970145,1,2:08,Ayo Dosunmu defensive rebound,4,ATL,17,29,145,155,,82.9
401809970146,1,1:53,Kevin Huerter makes 22-foot three point jumper (Tre Jones assists),4,ATL,20,29,146,92,True,79.6
401809970148,1,1:37,Onyeka Okongwu makes 1-foot two point shot (Nickeil Alexander-Walker assists),1,ATL,20,31,148,120,True,81.4
401809970150,1,1:25,Patrick Williams misses 25-foot three point jumper,4,ATL,20,31,150,92,,82.8
401809970151,1,1:23,Onyeka Okongwu defensive rebound,1,ATL,20,31,151,155,,83.3
401809970152,1,1:10,Onyeka Okongwu makes layup (Trae Young assists),1,ATL,20,33,152,141,True,84.9
401809970154,1,57.1,Ayo Dosunmu makes 23-foot three point jumper (Patrick Williams assists),4,ATL,23,33,154,92,True,81.6
401809970156,1,49.2,Trae Young misses 25-foot three point pullup jump shot,1,ATL,23,33,156,131,,80.1
401809970157,1,45.1,Tre Jones defensive rebound,4,ATL,23,33,157,155,,79.6
401809970158,1,44.3,Kevin Huerter makes two point shot (Tre Jones assists),4,ATL,25,33,158,129,True,77.7
401809970160,1,31.1,Tre Jones personal foul,4,ATL,25,33,160,45,,80.8
401809970162,1,31.1,Trae Young makes free throw 1 of 2,1,ATL,25,34,162,98,True,81.2
401809970163,1,31.1,Isaac Okoro enters the game for Jalen Smith,4,ATL,25,34,163,584,,81.2
401809970164,1,31.1,Dyson Daniels enters the game for Luke Kennard,1,ATL,25,34,164,584,,81.2
401809970167,1,31.1,Trae Young makes free throw 2 of 2,1,ATL,25,35,167,99,True,79.6
401809970168,1,17.5,Tre Jones makes 1-foot two point shot,4,ATL,27,35,168,128,True,77.7
401809970169,1,0.0,Trae Young misses 24-foot three point shot,1,ATL,27,35,169,114,,75.8
401809970170,1,0.0,Hawks offensive team rebound,1,ATL,27,35,170,156,,77.5
401809970171,1,0.0,End of the 1st Quarter,,ATL,27,35,171,412,,76.4
401809970172,2,12:00,Julian Phillips enters the game for Kevin Huerter,4,ATL,27,35,172,584,,76.4
401809970173,2,12:00,Kristaps Porzingis enters the game for Nickeil Alexander-Walker,1,ATL,27,35,173,584,,76.4
401809970174,2,12:00,Keaton Wallace enters the game for Trae Young,1,ATL,27,35,174,584,,76.4
401809970175,2,12:00,Luke Kennard enters the game for Mouhamed Gueye,1,ATL,27,35,175,584,,76.4
401809970176,2,12:00,Zaccharie Risacher enters the game for Dyson Daniels,1,ATL,27,35,176,584,,76.4
401809970183,2,11:43,Tre Jones makes 1-foot two point shot,4,ATL,29,35,183,128,True,73.2
401809970184,2,11:24,Zaccharie Risacher misses 26-foot three point jumper,1,ATL,29,35,184,92,,71.4
401809970185,2,11:21,Tre Jones defensive rebound,4,ATL,29,35,185,155,,70.8
401809970186,2,11:13,Ayo Dosunmu misses 25-foot three point jumper,4,ATL,29,35,186,92,,72.6
401809970187,2,11:11,Keaton Wallace defensive rebound,1,ATL,29,35,187,155,,73.2
401809970188,2,10:53,Kristaps Porzingis makes 16-foot step back jumpshot,1,ATL,29,37,188,132,True,75.5
401809970189,2,10:43,Isaac Okoro misses 25-foot three point step back jumpshot,4,ATL,29,37,189,132,,77.4
401809970190,2,10:41,Kristaps Porzingis defensive rebound,1,ATL,29,37,190,155,,78
401809970191,2,10:31,Keaton Wallace misses driving floating jump shot,1,ATL,29,37,191,144,,76.2
401809970192,2,10:30,Patrick Williams defensive rebound,4,ATL,29,37,192,155,,75.6
401809970193,2,10:26,Keaton Wallace personal foul,1,ATL,29,37,193,45,,75.5
401809970195,2,10:14,Ayo Dosunmu makes 1-foot two point shot,4,ATL,31,37,195,128,True,73.5
401809970196,2,9:57,Onyeka Okongwu misses 5-foot hook shot,1,ATL,31,37,196,93,,71.6
401809970197,2,9:55,Tre Jones defensive rebound,4,ATL,31,37,197,155,,70.9
401809970198,2,9:53,Onyeka Okongwu kicked ball violation,1,ATL,31,37,198,12,,73.6
401809970199,2,9:53,Josh Giddey enters the game for Tre Jones,4,ATL,31,37,199,584,,73.6
401809970201,2,9:44,Julian Phillips misses 24-foot three point jumper,4,ATL,31,37,201,92,,72.9
401809970202,2,9:41,Keaton Wallace defensive rebound,1,ATL,31,37,202,155,,73.6
401809970203,2,9:37,Julian Phillips shooting foul,4,ATL,31,37,203,44,,77
401809970205,2,9:37,Kristaps Porzingis makes free throw 1 of 2,1,ATL,31,38,205,98,True,77.6
401809970206,2,9:37,Kristaps Porzingis makes free throw 2 of 2,1,ATL,31,39,206,99,True,75.7
401809970207,2,9:23,Josh Giddey makes 26-foot three point jumper (Isaac Okoro assists),4,ATL,34,39,207,92,True,71
401809970209,2,9:09,Patrick Williams personal foul,4,ATL,34,39,209,45,,70.9
401809970211,2,9:00,Onyeka Okongwu misses driving floating jump shot,1,ATL,34,39,211,144,,69.1
401809970212,2,8:58,Josh Giddey defensive rebound,4,ATL,34,39,212,155,,68.4
401809970213,2,8:53,Onyeka Okongwu shooting foul,1,ATL,34,39,213,44,,64.1
401809970215,2,8:53,Ayo Dosunmu misses free throw 1 of 2,4,ATL,34,39,215,98,,66.3
401809970216,2,8:53,Bulls offensive team rebound,4,ATL,34,39,216,156,,68.3
401809970217,2,8:53,Matas Buzelis enters the game for Patrick Williams,4,ATL,34,39,217,584,,68.3
401809970218,2,8:53,Jalen Johnson enters the game for Kristaps Porzingis,1,ATL,34,39,218,584,,68.3
401809970221,2,8:53,Ayo Dosunmu makes free throw 2 of 2,4,ATL,35,39,221,99,True,68.4
401809970222,2,8:42,Onyeka Okongwu makes 25-foot three point jumper (Keaton Wallace assists),1,ATL,35,42,222,92,True,73.4
401809970224,2,8:28,Josh Giddey misses 24-foot three point jumper,4,ATL,35,42,224,92,,75.4
401809970225,2,8:28,Bulls offensive team rebound,4,ATL,35,42,225,156,,73.5
401809970226,2,8:28,Luke Kennard loose ball foul,1,ATL,35,42,226,43,,73.6
401809970228,2,8:28,Nikola Vucevic enters the game for Isaac Okoro,4,ATL,35,42,228,584,,73.6
401809970230,2,8:14,Matas Buzelis misses 15-foot two point shot,4,ATL,35,42,230,121,,75.4
401809970231,2,8:14,Bulls offensive team rebound,4,ATL,35,42,231,156,,73.6
401809970232,2,8:14,shot clock turnover ,4,ATL,35,42,232,70,,76
401809970233,2,8:02,Zaccharie Risacher traveling,1,ATL,35,42,233,64,,73.6
401809970234,2,7:41,Julian Phillips misses driving floating jump shot,4,ATL,35,42,234,144,,75.5
401809970235,2,7:39,Jalen Johnson defensive rebound,1,ATL,35,42,235,155,,76.1
401809970236,2,7:32,Julian Phillips blocks Jalen Johnson 's 1-foot layup,1,ATL,35,42,236,141,,74.3
401809970238,2,7:30,Nikola Vucevic defensive rebound,4,ATL,35,42,238,155,,73.7
401809970239,2,7:23,Matas Buzelis bad pass (Jalen Johnson steals),4,ATL,35,42,239,62,,76.2
401809970241,2,7:20,Jalen Johnson makes dunk,1,ATL,35,44,241,116,True,78.3
401809970242,2,7:07,Matas Buzelis misses two point shot,4,ATL,35,44,242,128,,80.1
401809970243,2,7:05,Onyeka Okongwu defensive rebound,1,ATL,35,44,243,155,,80.7
401809970244,2,6:59,Zaccharie Risacher misses two point shot,1,ATL,35,44,244,109,,79
401809970245,2,6:57,Nikola Vucevic defensive rebound,4,ATL,35,44,245,155,,78.4
401809970246,2,6:55,Bulls Full timeout,4,ATL,35,44,246,16,,78.4
401809970247,2,6:55,Kevin Huerter enters the game for Ayo Dosunmu,4,ATL,35,44,247,584,,78.4
401809970248,2,6:55,Dyson Daniels enters the game for Keaton Wallace,1,ATL,35,44,248,584,,78.4
401809970249,2,6:55,Trae Young enters the game for Luke Kennard,1,ATL,35,44,249,584,,78.4
401809970250,2,6:55,Nickeil Alexander-Walker enters the game for Zaccharie Risacher,1,ATL,35,44,250,584,,78.4
401809970255,2,6:46,Nikola Vucevic makes 10-foot two point shot (Matas Buzelis assists),4,ATL,37,44,255,130,True,76.3
401809970257,2,6:25,Jalen Johnson misses 22-foot three point jumper,1,ATL,37,44,257,92,,74.5
401809970258,2,6:23,Nikola Vucevic defensive rebound,4,ATL,37,44,258,155,,73.8
401809970259,2,6:14,Matas Buzelis misses 22-foot three point jumper,4,ATL,37,44,259,92,,75.7
401809970260,2,6:12,Onyeka Okongwu defensive rebound,1,ATL,37,44,260,155,,76.4
401809970261,2,6:08,Dyson Daniels misses two point shot,1,ATL,37,44,261,129,,74.5
401809970263,2,6:05,Nickeil Alexander-Walker offensive rebound,1,ATL,37,44,263,156,,76.4
401809970264,2,6:03,Trae Young makes 23-foot three point jumper (Nickeil Alexander-Walker assists),1,ATL,37,47,264,92,True,80.8
401809970266,2,5:52,Trae Young shooting foul,1,ATL,37,47,266,44,,77.6
401809970268,2,5:52,Kevin Huerter makes free throw 1 of 2,4,ATL,38,47,268,98,True,77
401809970269,2,5:52,Kevin Huerter makes free throw 2 of 2,4,ATL,39,47,269,99,True,79
401809970270,2,5:37,Nikola Vucevic shooting foul,4,ATL,39,47,270,44,,81.9
401809970272,2,5:37,Onyeka Okongwu misses free throw 1 of 2,1,ATL,39,47,272,98,,80.4
401809970273,2,5:37,Hawks offensive team rebound,1,ATL,39,47,273,156,,78.9
401809970274,2,5:37,Patrick Williams enters the game for Julian Phillips,4,ATL,39,47,274,584,,78.9
401809970276,2,5:37,Onyeka Okongwu misses free throw 2 of 2,1,ATL,39,47,276,99,,76.4
401809970277,2,5:35,Josh Giddey defensive rebound,4,ATL,39,47,277,155,,76.4
401809970278,2,5:23,Josh Giddey makes 6-foot two point shot (Nikola Vucevic assists),4,ATL,41,47,278,130,True,73.9
401809970280,2,5:04,Jalen Johnson makes 1-foot two point shot (Trae Young assists),1,ATL,41,49,280,128,True,76.5
401809970282,2,4:54,Kevin Huerter misses 25-foot three point jumper,4,ATL,41,49,282,92,,78.4
401809970283,2,4:52,Onyeka Okongwu defensive rebound,1,ATL,41,49,283,155,,79.1
401809970292,2,4:37,Kevin Huerter blocks Jalen Johnson's driving layup,1,ATL,41,49,292,110,,77.1
401809970294,2,4:37,Josh Giddey defensive rebound,4,ATL,41,49,294,155,,76.6
401809970286,2,4:30,Patrick Williams misses 27-foot three point jumper,4,ATL,41,49,286,92,,78.5
401809970287,2,4:26,Onyeka Okongwu defensive rebound,1,ATL,41,49,287,155,,79.2
401809970288,2,4:24,Kevin Huerter shooting foul,4,ATL,41,49,288,44,,82.2
401809970290,2,4:24,Trae Young misses free throw 1 of 2,1,ATL,41,49,290,98,,80.6
401809970291,2,4:24,Hawks offensive team rebound,1,ATL,41,49,291,156,,78.8
401809970295,2,4:24,Tre Jones enters the game for Josh Giddey,4,ATL,41,49,295,584,,78.8
401809970296,2,4:24,Kristaps Porzingis enters the game for Onyeka Okongwu,1,ATL,41,49,296,584,,78.8
401809970299,2,4:24,Trae Young makes free throw 2 of 2,1,ATL,41,50,299,99,True,79
401809970300,2,4:09,Nikola Vucevic misses 25-foot three point jumper,4,ATL,41,50,300,92,,80.7
401809970301,2,4:07,Jalen Johnson defensive rebound,1,ATL,41,50,301,155,,81.3
401809970302,2,3:59,Trae Young misses driving floating jump shot,1,ATL,41,50,302,144,,79.7
401809970303,2,3:56,Nikola Vucevic defensive rebound,4,ATL,41,50,303,155,,79.2
401809970304,2,3:54,Kevin Huerter lost ball turnover (Dyson Daniels steals),4,ATL,41,50,304,63,,81.3
401809970306,2,3:50,Jalen Johnson makes 1-foot dunk (Trae Young assists),1,ATL,41,52,306,116,True,83.4
401809970308,2,3:42,Nickeil Alexander-Walker personal foul,1,ATL,41,52,308,45,,80.3
401809970310,2,3:42,Nikola Vucevic makes free throw 1 of 2,4,ATL,42,52,310,98,True,79.8
401809970311,2,3:42,Nikola Vucevic makes free throw 2 of 2,4,ATL,43,52,311,99,True,81.4
401809970312,2,3:28,Kristaps Porzingis makes 8-foot pullup jump shot (Trae Young assists),1,ATL,43,54,312,131,True,83.5
401809970314,2,3:14,Matas Buzelis makes driving layup,4,ATL,45,54,314,110,True,81.5
401809970315,2,3:14,Nickeil Alexander-Walker shooting foul,1,ATL,45,54,315,44,,77.5
401809970317,2,3:14,Josh Giddey enters the game for Patrick Williams,4,ATL,45,54,317,584,,77.5
401809970319,2,3:14,Matas Buzelis makes free throw 1 of 1,4,ATL,46,54,319,97,True,79.1
401809970320,2,3:14,Hawks Full timeout,1,ATL,46,54,320,16,,79.1
401809970321,2,3:14,Ayo Dosunmu enters the game for Kevin Huerter,4,ATL,46,54,321,584,,79.1
401809970322,2,3:14,Patrick Williams enters the game for Matas Buzelis,4,ATL,46,54,322,584,,79.1
401809970325,2,2:57,Trae Young misses two point shot,1,ATL,46,54,325,126,,77.6
401809970326,2,2:55,Josh Giddey defensive rebound,4,ATL,46,54,326,155,,77
401809970327,2,2:51,Patrick Williams makes 22-foot three point shot (Ayo Dosunmu assists),4,ATL,49,54,327,113,True,71.6
401809970329,2,2:35,Kristaps Porzingis misses 27-foot three point jumper,1,ATL,49,54,329,92,,69.4
401809970330,2,2:31,Dyson Daniels offensive rebound,1,ATL,49,54,330,156,,71.7
401809970331,2,2:21,Trae Young misses 25-foot three point step back jumpshot,1,ATL,49,54,331,132,,69.4
401809970332,2,2:17,Nickeil Alexander-Walker offensive rebound,1,ATL,49,54,332,156,,71.7
401809970333,2,2:17,Nickeil Alexander-Walker makes tip shot,1,ATL,49,56,333,94,True,74.5
401809970334,2,1:56,Tre Jones makes 26-foot three point jumper (Nikola Vucevic assists),4,ATL,52,56,334,92,True,69
401809970336,2,1:43,Jalen Johnson misses 27-foot three point step back jumpshot,1,ATL,52,56,336,132,,66.4
401809970337,2,1:41,Ayo Dosunmu defensive rebound,4,ATL,52,56,337,155,,65.5
401809970338,2,1:37,Dyson Daniels shooting foul,1,ATL,52,56,338,44,,61
401809970340,2,1:37,Josh Giddey misses free throw 1 of 2,4,ATL,52,56,340,98,,63.6
401809970341,2,1:37,Bulls offensive team rebound,4,ATL,52,56,341,156,,65.5
401809970342,2,1:37,Josh Giddey makes free throw 2 of 2,4,ATL,53,56,342,99,True,66.1
401809970343,2,1:24,Jalen Johnson makes dunk (Trae Young assists),1,ATL,53,58,343,151,True,68.8
401809970345,2,1:04,Ayo Dosunmu misses 25-foot three point jumper,4,ATL,53,58,345,92,,71.2
401809970346,2,1:02,Jalen Johnson defensive rebound,1,ATL,53,58,346,155,,72
401809970347,2,58.1,Kristaps Porzingis misses 26-foot three point shot,1,ATL,53,58,347,113,,69.6
401809970348,2,56.5,Bulls defensive team rebound,4,ATL,53,58,348,155,,68.8
401809970350,2,45.3,Tre Jones misses two point shot,4,ATL,53,58,350,126,,71.2
401809970351,2,44.7,Patrick Williams offensive rebound,4,ATL,53,58,351,156,,68.9
401809970352,2,44.7,Patrick Williams makes two point shot,4,ATL,55,58,352,125,True,66.2
401809970353,2,44.7,Kristaps Porzingis shooting foul,1,ATL,55,58,353,44,,60.2
401809970355,2,44.7,Patrick Williams misses free throw 1 of 1,4,ATL,55,58,355,97,,66.2
401809970356,2,40.0,Nikola Vucevic offensive rebound,4,ATL,55,58,356,156,,63
401809970357,2,29.1,Patrick Williams misses 25-foot three point jumper,4,ATL,55,58,357,92,,65.4
401809970358,2,26.7,Tre Jones offensive rebound,4,ATL,55,58,358,156,,63
401809970359,2,17.9,Nikola Vucevic makes 6-foot hook shot (Josh Giddey assists),4,ATL,57,58,359,93,True,59
401809970361,2,0.0,Jalen Johnson misses 25-foot three point step back jumpshot,1,ATL,57,58,361,132,,56.5
401809970362,2,0.0,Hawks offensive team rebound,1,ATL,57,58,362,156,,59.3
401809970363,2,0.0,End of the 2nd Quarter,,ATL,57,58,363,412,,57.4
401809970364,3,12:00,Matas Buzelis enters the game for Ayo Dosunmu,4,ATL,57,58,364,584,,57.4
401809970365,3,12:00,Isaac Okoro enters the game for Patrick Williams,4,ATL,57,58,365,584,,57.4
401809970366,3,12:00,Zaccharie Risacher enters the game for Nickeil Alexander-Walker,1,ATL,57,58,366,584,,57.4
401809970371,3,11:36,Isaac Okoro makes 26-foot three point jumper (Nikola Vucevic assists),4,CHI,60,58,371,92,True,51.7
401809970373,3,11:24,Isaac Okoro personal foul,4,CHI,60,58,373,45,,51.4
401809970375,3,11:11,Jalen Johnson misses 4-foot two point shot,1,CHI,60,58,375,130,,54.3
401809970376,3,11:09,Jalen Johnson offensive rebound,1,CHI,60,58,376,156,,51.6
401809970377,3,11:09,Jalen Johnson makes tip shot,1,ATL,60,60,377,94,True,51.7
401809970378,3,10:52,Nikola Vucevic misses 3-foot two point shot,4,ATL,60,60,378,120,,54.7
401809970379,3,10:52,Hawks defensive team rebound,1,ATL,60,60,379,155,,55.7
401809970381,3,10:42,Trae Young makes 9-foot driving floating jump shot,1,ATL,60,62,381,144,True,59.1
401809970382,3,10:31,Nikola Vucevic makes 25-foot three point jumper (Tre Jones assists),4,ATL,63,62,382,92,True,51.8
401809970384,3,10:19,Kristaps Porzingis makes 27-foot three point jumper (Jalen Johnson assists),1,ATL,63,65,384,92,True,59.1
401809970386,3,10:01,Josh Giddey misses 25-foot three point pullup jump shot,4,ATL,63,65,386,131,,61.9
401809970387,3,9:59,Trae Young defensive rebound,1,ATL,63,65,387,155,,62.8
401809970388,3,9:56,Kristaps Porzingis makes 1-foot dunk (Trae Young assists),1,ATL,63,67,388,149,True,66.1
401809970390,3,9:52,Tre Jones out of bounds bad pass turnover,4,ATL,63,67,390,90,,69.5
401809970391,3,9:38,Jalen Johnson makes 11-foot two point shot (Trae Young assists),1,ATL,63,69,391,130,True,72.6
401809970393,3,9:30,Jalen Johnson shooting foul,1,ATL,63,69,393,44,,67.9
401809970395,3,9:30,Josh Giddey misses free throw 1 of 2,4,ATL,63,69,395,98,,70.4
401809970396,3,9:30,Bulls offensive team rebound,4,ATL,63,69,396,156,,72.7
401809970397,3,9:30,Josh Giddey makes free throw 2 of 2,4,ATL,64,69,397,99,True,72.8
401809970398,3,9:21,Nikola Vucevic kicked ball violation,4,ATL,64,69,398,12,,69.6
401809970399,3,9:10,Zaccharie Risacher misses two point shot,1,ATL,64,69,399,145,,70.5
401809970400,3,9:09,Nikola Vucevic defensive rebound,4,ATL,64,69,400,155,,69.7
401809970401,3,8:51,Matas Buzelis misses 26-foot three point jumper,4,ATL,64,69,401,92,,72.2
401809970402,3,8:47,Nikola Vucevic offensive rebound,4,ATL,64,69,402,156,,69.7
401809970403,3,8:45,Isaac Okoro makes layup (Nikola Vucevic assists),4,ATL,66,69,403,95,True,66.5
401809970405,3,8:32,Kristaps Porzingis misses driving layup,1,ATL,66,69,405,110,,63.7
401809970406,3,8:30,Jalen Johnson offensive rebound,1,ATL,66,69,406,156,,66.5
401809970407,3,8:29,Zaccharie Risacher misses 26-foot three point jumper,1,ATL,66,69,407,92,,63.7
401809970408,3,8:26,Josh Giddey defensive rebound,4,ATL,66,69,408,155,,62.7
401809970409,3,8:17,Tre Jones makes 25-foot three point jumper (Josh Giddey assists),4,ATL,69,69,409,92,True,55.5
401809970411,3,8:06,Trae Young bad pass (Josh Giddey steals),1,ATL,69,69,411,62,,51.3
401809970413,3,8:00,Matas Buzelis misses two point shot,4,ATL,69,69,413,109,,54.4
401809970414,3,8:00,Tre Jones offensive rebound,4,ATL,69,69,414,156,,51.3
401809970415,3,8:00,Tre Jones makes two point shot,4,CHI,71,69,415,109,True,52.4
401809970416,3,8:00,Hawks Full timeout,1,CHI,71,69,416,16,,52.4
