id,prd,clck,txt,tm,team,hmScr,awyScr,sq,plyTypId,scrng,wnPrb
401810044431,3,8:18,Nikola Jokic makes 6-foot pullup jump shot,7,DEN,68,61,431,131,True,80.9
401810044432,3,8:07,Aaron Nesmith makes 23-foot three point jumper (Pascal Siakam assists),11,DEN,68,64,432,92,True,75.5
401810044434,3,7:49,Cameron Johnson makes 2-foot two point shot (Nikola Jokic assists),7,DEN,70,64,434,128,True,78.4
401810044436,3,7:37,Pascal Siakam makes 6-foot two point shot,11,DEN,70,66,436,140,True,75.5
401810044437,3,7:17,Nikola Jokic makes finger roll layup (Christian Braun assists),7,DEN,72,66,437,124,True,78.4
401810044439,3,7:05,Andrew Nembhard misses driving floating jump shot,11,DEN,72,66,439,144,,80.6
401810044440,3,7:03,Nuggets defensive team rebound,7,DEN,72,66,440,155,,81.4
401810044441,3,7:03,Isaiah Jackson loose ball foul,11,DEN,72,66,441,43,,81.2
401810044443,3,7:03,Tim Hardaway Jr. enters the game for Jalen Pickett,7,DEN,72,66,443,584,,81.2
401810044444,3,7:03,Jeremiah Robinson-Earl enters the game for Jarace Walker,11,DEN,72,66,444,584,,81.2
401810044445,3,7:03,Tony Bradley enters the game for Isaiah Jackson,11,DEN,72,66,445,584,,81.2
401810044449,3,6:54,Cameron Johnson makes 2-foot two point shot,7,DEN,74,66,449,128,True,83.5
401810044450,3,6:54,Tony Bradley shooting foul,11,DEN,74,66,450,44,,87.4
401810044452,3,6:54,Cameron Johnson makes free throw 1 of 1,7,DEN,75,66,452,97,True,85.8
401810044453,3,6:37,Tim Hardaway Jr. personal foul,7,DEN,75,66,453,45,,82.4
401810044455,3,6:37,Andrew Nembhard makes 5-foot two point shot (Pascal Siakam assists),11,DEN,75,68,455,145,True,83.8
401810044457,3,6:37,Andrew Nembhard makes free throw 1 of 1,11,DEN,75,69,457,97,True,81.2
401810044460,3,6:22,Peyton Watson makes 3-foot two point shot (Tim Hardaway Jr. assists),7,DEN,77,69,460,128,True,83.7
401810044462,3,6:22,Aaron Nesmith shooting foul,11,DEN,77,69,462,44,,87.5
401810044464,3,6:22,Ben Sheppard enters the game for Aaron Nesmith,11,DEN,77,69,464,584,,87.5
401810044466,3,6:22,Peyton Watson makes free throw 1 of 1,7,DEN,78,69,466,97,True,85.9
401810044467,3,6:07,Jeremiah Robinson-Earl misses layup,11,DEN,78,69,467,141,,87.6
401810044468,3,6:04,Jeremiah Robinson-Earl offensive rebound,11,DEN,78,69,468,156,,85.9
401810044470,3,6:02,Jeremiah Robinson-Earl lost ball turnover (Cameron Johnson steals),11,DEN,78,69,470,63,,88.1
401810044472,3,5:57,Tim Hardaway Jr. makes 26-foot three point jumper (Peyton Watson assists),7,DEN,81,69,472,92,True,91.5
401810044474,3,5:55,Pacers Full timeout,11,DEN,81,69,474,16,,91.6
401810044475,3,5:46,Pascal Siakam misses driving layup,11,DEN,81,69,475,110,,92.7
401810044476,3,5:44,Peyton Watson defensive rebound,7,DEN,81,69,476,155,,93.1
401810044477,3,5:37,Tim Hardaway Jr. misses 25-foot three point jumper,7,DEN,81,69,477,92,,92
401810044478,3,5:35,Peyton Watson offensive rebound,7,DEN,81,69,478,156,,93.1
401810044480,3,5:30,Peyton Watson misses driving layup,7,DEN,81,69,480,110,,92.1
401810044481,3,5:30,Pascal Siakam defensive rebound,11,DEN,81,69,481,155,,91.7
401810044482,3,5:24,Ben Sheppard makes two point shot (Andrew Nembhard assists),11,DEN,81,71,482,129,True,90.1
401810044484,3,5:08,Christian Braun makes layup (Cameron Johnson assists),7,DEN,83,71,484,95,True,91.8
401810044486,3,4:53,Andrew Nembhard lost ball turnover (Christian Braun steals),11,DEN,83,71,486,63,,93.4
401810044488,3,4:50,Peyton Watson makes 1-foot dunk (Tim Hardaway Jr. assists),7,DEN,85,71,488,116,True,94.5
401810044489,3,4:41,Jeremiah Robinson-Earl makes 23-foot three point jumper (Pascal Siakam assists),11,DEN,85,74,489,92,True,92
401810044492,3,4:20,Ben Sheppard personal foul,11,DEN,85,74,492,45,,94.1
401810044494,3,4:20,Bruce Brown enters the game for Peyton Watson,7,DEN,85,74,494,584,,94.1
401810044495,3,4:20,Spencer Jones enters the game for Cameron Johnson,7,DEN,85,74,495,584,,94.1
401810044496,3,4:20,Monte Morris enters the game for Andrew Nembhard,11,DEN,85,74,496,584,,94.1
401810044497,3,4:20,Aaron Nesmith enters the game for Pascal Siakam,11,DEN,85,74,497,584,,94.1
401810044502,3,4:16,Christian Braun lost ball turnover (Jeremiah Robinson-Earl steals),7,DEN,85,74,502,63,,90.3
401810044504,3,4:11,Ben Sheppard misses two point shot,11,DEN,85,74,504,109,,91.6
401810044505,3,4:07,Tony Bradley offensive rebound,11,DEN,85,74,505,156,,90.4
401810044506,3,4:07,Tony Bradley makes tip shot,11,DEN,85,76,506,94,True,88.8
401810044507,3,3:53,Nikola Jokic bad pass (Aaron Nesmith steals),7,DEN,85,76,507,62,,86.4
401810044509,3,3:46,Aaron Nesmith misses running pullup jump shot,11,DEN,85,76,509,146,,88.3
401810044510,3,3:46,Jeremiah Robinson-Earl offensive rebound,11,DEN,85,76,510,156,,86.5
401810044511,3,3:46,Jeremiah Robinson-Earl misses tip shot,11,DEN,85,76,511,94,,88.3
401810044512,3,3:46,Tony Bradley offensive rebound,11,DEN,85,76,512,156,,86.5
401810044514,3,3:46,Nuggets Full timeout,7,DEN,85,76,514,16,,86.5
401810044515,3,3:46,(03:46) [Nuggets] COACH'S CHALLENGE (CALL STANDS) [Nuggets] charged with a timeout,7,DEN,85,76,515,216,,88.9
401810044516,3,3:46,Tony Bradley misses 1-foot tip shot,11,DEN,85,76,516,94,,88.3
401810044517,3,3:46,Pacers offensive team rebound,11,DEN,85,76,517,156,,86.5
401810044518,3,3:41,Aaron Nesmith makes 23-foot three point shot (Tony Bradley assists),11,DEN,85,79,518,121,True,81.8
401810044521,3,3:19,Bruce Brown makes driving layup (Nikola Jokic assists),7,DEN,87,79,521,110,True,84.6
401810044523,3,3:11,Bruce Brown personal foul,7,DEN,87,79,523,45,,80.1
401810044525,3,3:11,Aaron Nesmith makes free throw 1 of 2,11,DEN,87,80,525,98,True,79.3
401810044526,3,3:11,Aaron Nesmith makes free throw 2 of 2,11,DEN,87,81,526,99,True,82
401810044527,3,2:54,Tim Hardaway Jr. makes 26-foot three point jumper (Nikola Jokic assists),7,DEN,90,81,527,92,True,86.9
401810044529,3,2:40,Spencer Jones personal foul,7,DEN,90,81,529,45,,83.3
401810044531,3,2:40,Monte Morris misses free throw 1 of 2,11,DEN,90,81,531,98,,85.4
401810044532,3,2:40,Pacers offensive team rebound,11,DEN,90,81,532,156,,87
401810044533,3,2:40,Jonas Valanciunas enters the game for Nikola Jokic,7,DEN,90,81,533,584,,87
401810044535,3,2:40,Jay Huff enters the game for Tony Bradley,11,DEN,90,81,535,584,,87
401810044537,3,2:40,Monte Morris makes free throw 2 of 2,11,DEN,90,82,537,99,True,87.2
401810044538,3,2:25,Christian Braun misses driving layup,7,DEN,90,82,538,110,,85.5
401810044539,3,2:23,Jeremiah Robinson-Earl defensive rebound,11,DEN,90,82,539,155,,85
401810044540,3,2:20,Jay Huff misses 24-foot three point shot,11,DEN,90,82,540,113,,86.7
401810044541,3,2:18,Nuggets defensive team rebound,7,DEN,90,82,541,155,,87.3
401810044543,3,1:55,Tim Hardaway Jr. misses 22-foot step back jumpshot,7,DEN,90,82,543,132,,85.7
401810044544,3,1:51,Monte Morris defensive rebound,11,DEN,90,82,544,155,,85.2
401810044545,3,1:45,Aaron Nesmith misses driving layup,11,DEN,90,82,545,110,,87
401810044546,3,1:42,Christian Braun defensive rebound,7,DEN,90,82,546,155,,87.6
401810044547,3,1:24,Jonas Valanciunas makes 4-foot two point shot,7,DEN,92,82,547,120,True,90
401810044548,3,1:09,Aaron Nesmith lost ball turnover,11,DEN,92,82,548,63,,92
401810044549,3,1:09,Aaron Nesmith loose ball foul,11,DEN,92,82,549,43,,94.3
401810044551,3,1:09,Spencer Jones misses free throw 1 of 2,7,DEN,92,82,551,98,,93.1
401810044552,3,1:09,Nuggets offensive team rebound,7,DEN,92,82,552,156,,92
401810044553,3,1:09,Julian Strawther enters the game for Christian Braun,7,DEN,92,82,553,584,,92
401810044554,3,1:09,Andrew Nembhard enters the game for Monte Morris,11,DEN,92,82,554,584,,92
401810044555,3,1:09,Pascal Siakam enters the game for Jay Huff,11,DEN,92,82,555,584,,92
401810044559,3,1:09,Spencer Jones makes free throw 2 of 2,7,DEN,93,82,559,99,True,91.7
401810044575,3,1:09,Isaiah Jackson enters the game for Aaron Nesmith,11,DEN,93,82,575,584,,91.7
401810044560,3,52.1,Andrew Nembhard misses 4-foot jumper,11,DEN,93,82,560,92,,93.2
401810044562,3,47.5,Tim Hardaway Jr. defensive rebound,7,DEN,93,82,562,155,,93.6
401810044563,3,46.0,Bruce Brown misses two point shot,7,DEN,93,82,563,109,,92.4
401810044564,3,44.6,Spencer Jones offensive rebound,7,DEN,93,82,564,156,,93.7
401810044565,3,44.6,Spencer Jones misses tip shot,7,DEN,93,82,565,94,,92.4
401810044566,3,44.6,Bruce Brown offensive rebound,7,DEN,93,82,566,156,,93.7
401810044567,3,42.7,Bruce Brown makes two point shot,7,DEN,95,82,567,125,True,95
401810044568,3,29.5,Isaiah Jackson misses 6-foot two point shot,11,DEN,95,82,568,119,,95.9
401810044569,3,29.5,Jonas Valanciunas defensive rebound,7,DEN,95,82,569,155,,96.2
401810044570,3,5.3,Julian Strawther misses 12-foot step back jumpshot,7,DEN,95,82,570,132,,95.6
401810044571,3,1.7,Pascal Siakam defensive rebound,11,DEN,95,82,571,155,,95.4
401810044572,3,0.1,Pascal Siakam misses heave jump shot,11,DEN,95,82,572,282,,96
401810044573,3,0.1,Pacers offensive team rebound,11,DEN,95,82,573,156,,95.1
401810044574,3,0.0,End of the 3rd Quarter,,DEN,95,82,574,412,,95.7
401810044577,4,12:00,Cody Martin enters the game for Jeremiah Robinson-Earl,11,DEN,95,82,577,584,,95.7
401810044580,4,11:44,Tim Hardaway Jr. misses 12-foot two point shot,7,DEN,95,82,580,137,,95.7
401810044581,4,11:41,Isaiah Jackson defensive rebound,11,DEN,95,82,581,155,,95.4
401810044582,4,11:33,Pascal Siakam makes 10-foot pullup jump shot (Andrew Nembhard assists),11,DEN,95,84,582,131,True,94.5
401810044584,4,11:12,Julian Strawther makes layup (Jonas Valanciunas assists),7,DEN,97,84,584,142,True,95.7
401810044586,4,11:06,Ben Sheppard misses 24-foot three point jumper,11,DEN,97,84,586,92,,96.5
401810044587,4,11:03,Bruce Brown defensive rebound,7,DEN,97,84,587,155,,96.8
401810044588,4,10:56,Bruce Brown misses two point shot,7,DEN,97,84,588,128,,96.1
401810044590,4,10:56,Pacers defensive team rebound,11,DEN,97,84,590,155,,95.8
401810044592,4,10:45,Bruce Brown personal foul,7,DEN,97,84,592,45,,95.6
401810044594,4,10:42,Andrew Nembhard misses 24-foot three point pullup jump shot,11,DEN,97,84,594,131,,96.6
401810044595,4,10:39,Julian Strawther defensive rebound,7,DEN,97,84,595,155,,96.9
401810044596,4,10:27,Spencer Jones misses 23-foot three point jumper,7,DEN,97,84,596,92,,96.2
401810044597,4,10:25,Isaiah Jackson defensive rebound,11,DEN,97,84,597,155,,96
401810044598,4,10:19,Ben Sheppard misses 24-foot three point jumper,11,DEN,97,84,598,92,,96.8
401810044599,4,10:14,Bruce Brown defensive rebound,7,DEN,97,84,599,155,,97.1
401810044601,4,9:55,Tim Hardaway Jr. offensive foul,7,DEN,97,84,601,42,,96.2
401810044603,4,9:55,Tim Hardaway Jr. turnover,7,DEN,97,84,603,84,,96.2
401810044604,4,9:44,Cody Martin misses 24-foot three point jumper,11,DEN,97,84,604,92,,97.1
401810044605,4,9:42,Jonas Valanciunas defensive rebound,7,DEN,97,84,605,155,,97.3
401810044607,4,9:29,Julian Strawther makes 8-foot driving floating jump shot (Jonas Valanciunas assists),7,DEN,99,84,607,144,True,98.1
401810044609,4,9:29,Ben Sheppard shooting foul,11,DEN,99,84,609,44,,99
401810044611,4,9:29,Cameron Johnson enters the game for Tim Hardaway Jr.,7,DEN,99,84,611,584,,99
401810044613,4,9:29,Julian Strawther makes free throw 1 of 1,7,DEN,100,84,613,97,True,98.7
401810044614,4,9:18,Andrew Nembhard makes 10-foot driving floating jump shot,11,DEN,100,86,614,144,True,98.2
401810044616,4,9:03,Jonas Valanciunas makes 2-foot two point shot (Cameron Johnson assists),7,DEN,102,86,616,120,True,98.8
401810044618,4,8:56,Pascal Siakam traveling,11,DEN,102,86,618,64,,99.2
401810044619,4,8:38,Julian Strawther misses 25-foot three point jumper,7,DEN,102,86,619,92,,99
401810044620,4,8:31,Jonas Valanciunas offensive rebound,7,DEN,102,86,620,156,,99.2
401810044621,4,8:31,Jonas Valanciunas misses tip shot,7,DEN,102,86,621,94,,99
401810044622,4,8:31,Cody Martin defensive rebound,11,DEN,102,86,622,155,,98.9
401810044623,4,8:19,Isaiah Jackson misses 15-foot jumper,11,DEN,102,86,623,92,,99.2
401810044624,4,8:16,Julian Strawther defensive rebound,7,DEN,102,86,624,155,,99.3
401810044625,4,7:58,Jonas Valanciunas 3 second turnover,7,DEN,102,86,625,67,,99.1
401810044628,4,7:58,Pacers Full timeout,11,DEN,102,86,628,16,,99.1
401810044629,4,7:58,Nikola Jokic enters the game for Jonas Valanciunas,7,DEN,102,86,629,584,,99.1
401810044630,4,7:58,Peyton Watson enters the game for Spencer Jones,7,DEN,102,86,630,584,,99.1
401810044631,4,7:58,Jarace Walker enters the game for Cody Martin,11,DEN,102,86,631,584,,99.1
401810044632,4,7:58,Tony Bradley enters the game for Isaiah Jackson,11,DEN,102,86,632,584,,99.1
401810044633,4,7:58,Aaron Nesmith enters the game for Ben Sheppard,11,DEN,102,86,633,584,,99.1
401810044639,4,7:40,Julian Strawther personal foul,7,DEN,102,86,639,45,,99
401810044641,4,7:30,Pascal Siakam misses driving layup,11,DEN,102,86,641,110,,99.3
401810044642,4,7:27,Tony Bradley offensive rebound,11,DEN,102,86,642,156,,99.1
401810044643,4,7:26,Tony Bradley bad pass (Peyton Watson steals),11,DEN,102,86,643,62,,99.4
401810044645,4,7:19,Pascal Siakam shooting foul,11,DEN,102,86,645,44,,99.7
401810044647,4,7:19,Nikola Jokic makes free throw 1 of 2,7,DEN,103,86,647,98,True,99.7
401810044648,4,7:19,Nikola Jokic makes free throw 2 of 2,7,DEN,104,86,648,99,True,99.6
401810044649,4,7:05,Andrew Nembhard bad pass (Nikola Jokic steals),11,DEN,104,86,649,62,,99.7
401810044651,4,7:03,Peyton Watson makes 2-foot dunk (Nikola Jokic assists),7,DEN,106,86,651,116,True,99.8
401810044653,4,6:53,Tony Bradley makes 4-foot layup (Andrew Nembhard assists),11,DEN,106,88,653,141,True,99.7
401810044655,4,6:31,Tony Bradley personal foul,11,DEN,106,88,655,45,,99.8
401810044657,4,6:20,Andrew Nembhard personal foul,11,DEN,106,88,657,45,,99.9
401810044659,4,6:07,Nikola Jokic makes 29-foot three point jumper (Cameron Johnson assists),7,DEN,109,88,659,92,True,99.9
401810044661,4,5:53,Andrew Nembhard misses two point shot,11,DEN,109,88,661,128,,99.9
401810044662,4,5:50,Pascal Siakam offensive rebound,11,DEN,109,88,662,156,,99.9
401810044663,4,5:48,Nikola Jokic flagrant foul type 1,7,DEN,109,88,663,32,,99.9
401810044665,4,5:48,(05:48) [Pacers] REF-INITIATED REVIEW (CALL OVERTURNED),,DEN,109,88,665,279,,99.9
401810044666,4,5:48,Jay Huff enters the game for Andrew Nembhard,11,DEN,109,88,666,584,,99.9
401810044667,4,5:48,Ben Sheppard enters the game for Pascal Siakam,11,DEN,109,88,667,584,,99.9
401810044668,4,5:48,Cody Martin enters the game for Jarace Walker,11,DEN,109,88,668,584,,99.9
401810044669,4,5:48,Monte Morris enters the game for Tony Bradley,11,DEN,109,88,669,584,,99.9
401810044670,4,5:48,Jeremiah Robinson-Earl enters the game for Aaron Nesmith,11,DEN,109,88,670,584,,99.9
401810044677,4,5:48,Pascal Siakam makes free throw flagrant 1 of 2,11,DEN,109,89,677,104,True,99.8
401810044685,4,5:48,Pascal Siakam makes free throw flagrant 2 of 2,11,DEN,109,90,685,105,True,99.8
401810044676,4,5:34,Ben Sheppard lost ball turnover (Cameron Johnson steals),11,DEN,109,88,676,63,,99.9
401810044679,4,5:31,Jay Huff flagrant foul type 1,11,DEN,109,89,679,32,,99.9
401810044686,4,5:31,(05:31) [Pacers] REF-INITIATED REVIEW (CALL OVERTURNED),,DEN,109,90,686,279,,99.9
401810044687,4,5:31,Julian Strawther misses free throw flagrant 1 of 2,7,DEN,109,90,687,104,,99.9
401810044688,4,5:31,Nuggets offensive team rebound,7,DEN,109,90,688,156,,99.9
401810044689,4,5:31,Julian Strawther makes free throw flagrant 2 of 2,7,DEN,110,90,689,105,True,99.9
401810044690,4,5:24,Cameron Johnson misses two point shot,7,DEN,110,90,690,128,,99.9
401810044691,4,5:23,Jay Huff defensive rebound,11,DEN,110,90,691,155,,99.9
401810044692,4,5:16,Jay Huff misses 24-foot three point jumper,11,DEN,110,90,692,92,,99.9
401810044693,4,5:14,Nikola Jokic defensive rebound,7,DEN,110,90,693,155,,99.9
401810044694,4,5:08,Cody Martin personal foul,11,DEN,110,90,694,45,,99.9
401810044696,4,5:08,Nikola Jokic makes free throw 1 of 2,7,DEN,111,90,696,98,True,99.9
401810044697,4,5:08,RayJ Dennis enters the game for Ben Sheppard,11,DEN,111,90,697,584,,99.9
401810044699,4,5:08,Nikola Jokic misses free throw 2 of 2,7,DEN,111,90,699,99,,99.9
401810044700,4,5:06,Jay Huff defensive rebound,11,DEN,111,90,700,155,,99.9
401810044701,4,4:52,Monte Morris misses 24-foot three point pullup jump shot,11,DEN,111,90,701,131,,99.9
401810044702,4,4:46,Jay Huff offensive rebound,11,DEN,111,90,702,156,,99.9
401810044703,4,4:46,Jay Huff makes dunk,11,DEN,111,92,703,150,True,99.9
401810044704,4,4:25,Julian Strawther makes 11-foot driving floating jump shot (Nikola Jokic assists),7,DEN,113,92,704,144,True,99.9
401810044706,4,4:17,Julian Strawther shooting foul,7,DEN,113,92,706,44,,99.9
401810044708,4,4:17,Cody Martin misses free throw 1 of 2,11,DEN,113,92,708,98,,99.9
401810044709,4,4:17,Cody Martin makes free throw 2 of 2,11,DEN,113,93,709,99,True,99.9
401810044710,4,4:17,Pacers offensive team rebound,11,DEN,113,93,710,156,,99.9
401810044711,4,3:55,Julian Strawther misses 26-foot three point pullup jump shot,7,DEN,113,93,711,131,,99.9
401810044712,4,3:53,Pacers defensive team rebound,11,DEN,113,93,712,155,,99.9
401810044714,4,3:48,Jeremiah Robinson-Earl makes driving layup (RayJ Dennis assists),11,DEN,113,95,714,110,True,99.9
401810044715,4,3:34,Jay Huff blocks Nikola Jokic 's 4-foot driving layup,7,DEN,113,95,715,110,,99.9
401810044717,4,3:33,Nikola Jokic offensive rebound,7,DEN,113,95,717,156,,99.9
401810044718,4,3:33,Jay Huff shooting foul,11,DEN,113,95,718,44,,99.9
401810044721,4,3:33,Nikola Jokic makes free throw 1 of 2,7,DEN,114,95,721,98,True,99.9
401810044722,4,3:33,Nikola Jokic makes free throw 2 of 2,7,DEN,115,95,722,99,True,99.9
401810044723,4,3:25,RayJ Dennis misses 26-foot three point jumper,11,DEN,115,95,723,92,,99.9
401810044724,4,3:23,Julian Strawther defensive rebound,7,DEN,115,95,724,155,,99.9
401810044725,4,3:14,Nikola Jokic out of bounds bad pass turnover,7,DEN,115,95,725,90,,99.9
401810044726,4,3:14,Nuggets Full timeout,7,DEN,115,95,726,16,,99.9
401810044727,4,3:14,Zeke Nnaji enters the game for Peyton Watson,7,DEN,115,95,727,584,,99.9
401810044728,4,3:14,Jalen Pickett enters the game for Bruce Brown,7,DEN,115,95,728,584,,99.9
401810044729,4,3:14,Hunter Tyson enters the game for Nikola Jokic,7,DEN,115,95,729,584,,99.9
401810044730,4,3:14,Spencer Jones enters the game for Cameron Johnson,7,DEN,115,95,730,584,,99.9
401810044735,4,3:02,Monte Morris misses driving layup,11,DEN,115,95,735,110,,99.9
401810044736,4,2:58,Jay Huff offensive rebound,11,DEN,115,95,736,156,,99.9
401810044737,4,2:58,Jay Huff misses tip shot,11,DEN,115,95,737,94,,99.9
401810044738,4,2:57,Hunter Tyson defensive rebound,7,DEN,115,95,738,155,,99.9
401810044739,4,2:42,Jay Huff blocks Jalen Pickett 's 3-foot driving layup,7,DEN,115,95,739,110,,99.9
401810044741,4,2:39,RayJ Dennis defensive rebound,11,DEN,115,95,741,155,,99.9
401810044742,4,2:22,Zeke Nnaji shooting foul,7,DEN,115,95,742,44,,99.9
401810044744,4,2:22,Jay Huff makes free throw 1 of 2,11,DEN,115,96,744,98,True,99.9
401810044745,4,2:22,Ben Sheppard enters the game for Jeremiah Robinson-Earl,11,DEN,115,96,745,584,,99.9
401810044747,4,2:22,Jay Huff makes free throw 2 of 2,11,DEN,115,97,747,99,True,99.9
401810044748,4,2:07,Julian Strawther misses 25-foot three point jumper,7,DEN,115,97,748,92,,99.9
401810044749,4,2:04,Ben Sheppard defensive rebound,11,DEN,115,97,749,155,,99.9
401810044750,4,1:55,RayJ Dennis misses driving floating jump shot,11,DEN,115,97,750,144,,99.9
401810044751,4,1:51,RayJ Dennis offensive rebound,11,DEN,115,97,751,156,,99.9
401810044752,4,1:49,Ben Sheppard misses 24-foot three point jumper,11,DEN,115,97,752,92,,99.9
401810044753,4,1:46,Jalen Pickett defensive rebound,7,DEN,115,97,753,155,,99.9
401810044754,4,1:40,Julian Strawther makes 1-foot two point shot,7,DEN,117,97,754,128,True,99.9
401810044755,4,1:18,RayJ Dennis misses 25-foot three point jumper,11,DEN,117,97,755,92,,99.9
401810044756,4,1:14,Julian Strawther defensive rebound,7,DEN,117,97,756,155,,99.9
401810044757,4,1:09,Julian Strawther misses driving floating jump shot,7,DEN,117,97,757,144,,99.9
401810044758,4,1:06,Hunter Tyson offensive rebound,7,DEN,117,97,758,156,,99.9
401810044759,4,1:02,Zeke Nnaji misses 26-foot three point jumper,7,DEN,117,97,759,92,,99.9
401810044760,4,1:00,Cody Martin defensive rebound,11,DEN,117,97,760,155,,99.9
401810044761,4,52.3,Zeke Nnaji shooting foul,7,DEN,117,97,761,44,,99.9
401810044763,4,52.3,Cody Martin makes free throw 1 of 2,11,DEN,117,98,763,98,True,99.9
401810044764,4,52.3,Cody Martin misses free throw 2 of 2,11,DEN,117,98,764,99,,99.9
401810044765,4,50.7,Hunter Tyson defensive rebound,7,DEN,117,98,765,155,,99.9
401810044766,4,42.8,Jay Huff blocks Hunter Tyson 's 3-foot driving layup,7,DEN,117,98,766,110,,99.9
401810044768,4,42.8,Nuggets offensive team rebound,7,DEN,117,98,768,156,,99.9
401810044770,4,39.0,Cody Martin blocks Hunter Tyson 's 16-foot jumper,7,DEN,117,98,770,92,,99.9
401810044772,4,36.4,Ben Sheppard defensive rebound,11,DEN,117,98,772,155,,99.9
401810044773,4,30.9,Cody Martin misses 26-foot three point jumper,11,DEN,117,98,773,92,,99.9
401810044774,4,27.3,Zeke Nnaji defensive rebound,7,DEN,117,98,774,155,,99.9
401810044775,4,26.9,Zeke Nnaji bad pass (Monte Morris steals),7,DEN,117,98,775,62,,99.9
401810044777,4,26.9,Monte Morris makes layup,11,DEN,117,100,777,95,True,99.9
401810044778,4,2.9,shot clock turnover ,7,DEN,117,100,778,70,,99.9
401810044779,4,0.0,End of the 4th Quarter,,DEN,117,100,779,412,,100
401810044780,4,0.0,End of Game,,DEN,117,100,780,402,,100
